{
  "$schema": "http://json-schema.org/draft-07/schema#",
  "title": "Schema for coordinating processing in imars3d",
  "type": "object",
  "properties": {
    "facility": {
      "type": "string",
      "enum": ["HFIR", "SNS"],
      "description": "Facility for the measurment"
    },
    "instrument": {
      "type": "string",
      "enum": ["CG1D", "SNAP"],
      "description": "Instrument for the measurment"
    },
    "ipts": {
      "type": "string",
      "description": "The full IPTS identifier for the measurement"
    },
    "name": {
      "type": "string",
      "description": "Rememberable name for the measurement"
    },
    "workingdir": {
      "type": "string",
      "description": "Directory to write intermediate results when requested"
    },
    "outputdir": {
      "type": "string",
      "description": "Directory to write final results"
    },
    "tasks": {
      "type": "array",
      "minItems": 1,
      "description": "Each task is a step in the tomographic reconstruction",
      "items": {
        "properties": {
          "name": {
            "type": "string",
            "description": "Friendly name for the task"
          },
          "function": {
            "type": "string",
            "description": "Fully qualified python name for the task"
          },
          "inputs": {
            "type": "object",
            "description": "Dictionary of inputs to the task. These are in the form of key value pairs that are passed into the task."
          },
          "outputs": {
            "type": "array",
            "description": "List of outputs from the task"
          }
        },
        "required": ["name", "function"]
      }
    }
  },
    "required": ["facility", "instrument", "ipts", "name", "workingdir", "outputdir", "tasks"]
}
