{
    "facility": "HFIR",
    "instrument": "CG1D",
    "ipts": "IPTS-1234",
    "name": "name for reconstructed ct scans",
    "workingdir": "/path/to/working/dir",
    "outputdir": "/tmp/imars3d/",
    "tasks": [{
            "name": "task1",
            "function": "imars3d.backend.io.data.load_data",
            "inputs": {
                "ct_dir": "/HFIR/CG1D/IPTS-25777/raw/ct_scans/iron_man",
                "ob_dir": "/HFIR/CG1D/IPTS-25777/raw/ob/Oct29_2019/",
                "dc_dir": "/HFIR/CG1D/IPTS-25777/raw/df/Oct29_2019/",
                "ct_fnmatch": "*.tiff",
                "ob_fnmatch": "*.tiff",
                "dc_fnmatch": "*.tiff"
            },
            "outputs": ["ct", "ob", "dc", "rot_angles"]
        },
        {
            "name": "task2.1",
            "function": "imars3d.backend.morph.crop.crop",
            "inputs": {
                "arrays": "ct",
                "crop_limit": [552, 1494, 771, 1296]
            },
            "outputs": ["ct"]
        },
        {
            "name": "task2.2",
            "function": "imars3d.backend.morph.crop.crop",
            "inputs": {
                "arrays": "ob",
                "crop_limit": [552, 1494, 771, 1296]
            },
            "outputs": ["ob"]
        },
        {
            "name": "task2.3",
            "function": "imars3d.backend.morph.crop.crop",
            "inputs": {
                "arrays": "dc",
                "crop_limit": [552, 1494, 771, 1296]
            },
            "outputs": ["dc"]
        },
        {
            "name": "task3",
            "function": "imars3d.backend.corrections.gamma_filter.gamma_filter",
            "inputs": {
                "arrays" : "ct"
            },
            "outputs": ["ct"]
        },
        {
            "name": "task4",
            "function": "imars3d.backend.preparation.normalization.normalization",
            "inputs": {
                "arrays": "ct",
                "flats": "ob",
                "darks": "dc"
            },
            "outputs": ["ct"]
        },
        {
            "name": "task5",
            "function": "imars3d.backend.corrections.denoise.denoise",
            "inputs": {
                "arrays": "ct"
            },
            "outputs": ["ct"]
        },
        {
            "name": "task6",
            "function": "imars3d.backend.corrections.ring_removal.remove_ring_artifact",
            "inputs": {
                "arrays": "ct"
            },
            "outputs": ["ct"]
        },
        {
            "name": "task7",
            "function": "imars3d.backend.diagnostics.rotation.find_rotation_center",
            "inputs": {
                "arrays": "ct",
                "angles": "rot_angles",
                "in_degrees": true,
                "atol_deg": 0.5
            },
            "outputs": ["rot_center"]
        },
        {
            "name": "task8",
            "function": "imars3d.backend.reconstruction.recon",
            "inputs": {
                "arrays": "ct",
                "theta": "rot_angles",
                "center": "rot_center",
                "is_radians": false,
                "perform_minus_log": true
            },
            "outputs": ["result"]
        },
        {
            "name": "task9",
            "function": "imars3d.backend.io.data.save_data",
            "inputs": {
                "data": "result",
                "filename": "test",
                "outputdir" : "outputdir"
            },
            "outputs": []
        }
    ]
}
