{
    "facility": "HFIR",
    "instrument": "CG1D",
    "ipts": "IPTS-1234",
    "name": "name for reconstructed ct scans",
    "workingdir": "/path/to/working/dir",
    "outputdir": "/tmp/imars3d/",
    "tasks": [{
            "name": "task1",
            "function": "imars3d.backend.dataio.data.load_data",
            "inputs": {
                "ct_dir": "tests/data/imars3d-data/HFIR/CG1D/IPTS-25777/raw/ct_scans/iron_man",
                "ob_dir": "tests/data/imars3d-data/HFIR/CG1D/IPTS-25777/raw/ob/Oct29_2019/",
                "dc_dir": "tests/data/imars3d-data/HFIR/CG1D/IPTS-25777/raw/df/Oct29_2019/",
                "ct_fnmatch": "*.tiff",
                "ob_fnmatch": "*.tiff",
                "dc_fnmatch": "*.tiff"
            },
            "outputs": ["result", "ob", "dc", "rot_angles"]
        },
        {
            "name": "task9",
            "function": "imars3d.backend.dataio.data.save_data",
            "inputs": {
                "data": "result",
                "name": "testfull",
                "outputbase" : "outputdir"
            },
            "outputs": []
        }
    ]
}
